{
  "$schema": "https://json-schema.org/draft/2020-12/schema",
  "$id": "https://github.com/aws-deadline/deadline-cloud-samples/blob/mainline/sample_catalog.schema.json",
  "title": "AWS Deadline Cloud sample catalog",
  "type": "object",
  "additionalProperties": false,
  "required": ["schema_version", "taxonomy", "inventory", "samples"],
  "properties": {
    "schema_version": {"type": "integer", "const": 1},
    "taxonomy": {
      "type": "object",
      "additionalProperties": false,
      "required": ["categories", "tasks", "journeys"],
      "properties": {
        "categories": {"$ref": "#/$defs/taxonomyItems"},
        "tasks": {"$ref": "#/$defs/taxonomyItems"},
        "journeys": {"$ref": "#/$defs/taxonomyItems"}
      }
    },
    "inventory": {
      "type": "object",
      "additionalProperties": false,
      "required": ["roots", "exclusions"],
      "properties": {
        "roots": {
          "type": "array",
          "minItems": 1,
          "items": {
            "type": "object",
            "additionalProperties": false,
            "required": ["path", "kind"],
            "properties": {
              "path": {"$ref": "#/$defs/repositoryPath"},
              "kind": {"enum": ["directory", "file"]},
              "pattern": {"type": "string", "minLength": 1}
            }
          }
        },
        "exclusions": {
          "type": "array",
          "items": {
            "type": "object",
            "additionalProperties": false,
            "required": ["path", "reason"],
            "properties": {
              "path": {"$ref": "#/$defs/repositoryPath"},
              "reason": {"type": "string", "minLength": 20}
            }
          }
        }
      }
    },
    "samples": {
      "type": "array",
      "minItems": 1,
      "items": {"$ref": "#/$defs/sample"}
    }
  },
  "$defs": {
    "repositoryPath": {
      "type": "string",
      "minLength": 1,
      "pattern": "^[A-Za-z0-9._-]+(?:/[A-Za-z0-9._-]+)*$"
    },
    "taxonomyItems": {
      "type": "array",
      "minItems": 1,
      "items": {
        "type": "object",
        "additionalProperties": false,
        "required": ["id", "label", "description"],
        "properties": {
          "id": {"type": "string", "pattern": "^[a-z0-9]+(?:-[a-z0-9]+)*$"},
          "label": {"type": "string", "minLength": 2},
          "description": {"type": "string", "minLength": 20}
        }
      }
    },
    "sample": {
      "type": "object",
      "additionalProperties": false,
      "required": ["path", "title", "description", "category", "tasks"],
      "properties": {
        "path": {"$ref": "#/$defs/repositoryPath"},
        "title": {"type": "string", "minLength": 3, "maxLength": 100},
        "description": {"type": "string", "minLength": 30, "maxLength": 300},
        "category": {
          "enum": [
            "infrastructure", "job-bundle", "software-package", "container",
            "queue-environment", "host-configuration", "submission-hook",
            "utility", "agent-skill"
          ]
        },
        "tasks": {
          "type": "array",
          "minItems": 1,
          "uniqueItems": true,
          "items": {
            "enum": [
              "deploy-farm", "manage-fleet", "monitor-events", "submit-job",
              "render-content", "process-media", "run-simulation", "run-ml-workload",
              "run-scientific-workload", "manage-assets", "build-software",
              "provide-software", "install-plugins", "configure-workers",
              "integrate-pipeline", "customize-submission", "troubleshoot-workers",
              "develop-samples"
            ]
          }
        },
        "journeys": {
          "type": "array",
          "uniqueItems": true,
          "items": {"enum": ["new-application", "custom-plugins", "studio-integration"]}
        },
        "platforms": {
          "type": "array",
          "uniqueItems": true,
          "items": {"enum": ["linux", "windows", "macos", "platform-independent"]}
        },
        "tags": {
          "type": "array",
          "uniqueItems": true,
          "items": {"type": "string", "pattern": "^[a-z0-9]+(?:[.-][a-z0-9]+)*$"}
        },
        "status": {"enum": ["active", "reference", "deprecated"]},
        "updated": {"type": "string", "format": "date"},
        "featured": {"type": "boolean"}
      }
    }
  }
}
