{
  "schema_version": 1,
  "taxonomy": {
    "categories": [
      {
        "id": "infrastructure",
        "label": "Infrastructure as code",
        "description": "Deploy or operate farms, queues, fleets, storage, and event integrations."
      },
      {
        "id": "job-bundle",
        "label": "OpenJD job bundles",
        "description": "Submit rendering, simulation, media, machine learning, and utility workloads."
      },
      {
        "id": "software-package",
        "label": "Conda recipes and build jobs",
        "description": "Build applications, adaptors, renderers, and plugins for worker delivery."
      },
      {
        "id": "container",
        "label": "Worker containers",
        "description": "Build container images for local compatibility testing or containerized jobs."
      },
      {
        "id": "queue-environment",
        "label": "Queue environments",
        "description": "Prepare session-scoped software and licensing for every job on a queue."
      },
      {
        "id": "host-configuration",
        "label": "Host configuration scripts",
        "description": "Configure service-managed fleet workers with elevated privileges at startup."
      },
      {
        "id": "submission-hook",
        "label": "Submission hooks",
        "description": "Apply organization policy or enrich job templates before submission."
      },
      {
        "id": "utility",
        "label": "Utility scripts",
        "description": "Automate supporting Deadline Cloud asset and workflow operations."
      },
      {
        "id": "agent-skill",
        "label": "Agent skills",
        "description": "Guide coding agents through repeatable sample authoring and software setup tasks."
      }
    ],
    "tasks": [
      {
        "id": "deploy-farm",
        "label": "Deploy a farm",
        "description": "Create Deadline Cloud farms and their supporting AWS infrastructure."
      },
      {
        "id": "manage-fleet",
        "label": "Manage fleet capacity",
        "description": "Configure worker connectivity, capacity, scheduling, and health."
      },
      {
        "id": "monitor-events",
        "label": "Monitor events and budgets",
        "description": "Route Deadline Cloud lifecycle or budget events to operational destinations."
      },
      {
        "id": "submit-job",
        "label": "Author and submit jobs",
        "description": "Create or run OpenJD job bundles through Deadline Cloud."
      },
      {
        "id": "render-content",
        "label": "Render DCC content",
        "description": "Render scenes and images with digital content creation applications."
      },
      {
        "id": "process-media",
        "label": "Process media",
        "description": "Encode, assemble, or publish image sequences and review media."
      },
      {
        "id": "run-simulation",
        "label": "Run simulations",
        "description": "Distribute physical, robotics, driving, procedural, or financial simulations."
      },
      {
        "id": "run-ml-workload",
        "label": "Run machine learning workloads",
        "description": "Distribute model training, inference, evaluation, or classification."
      },
      {
        "id": "run-scientific-workload",
        "label": "Run scientific workloads",
        "description": "Distribute computational biology, chemistry, or molecular workloads."
      },
      {
        "id": "manage-assets",
        "label": "Move job assets",
        "description": "Upload, discover, stage, or retrieve job inputs and outputs."
      },
      {
        "id": "build-software",
        "label": "Build software packages",
        "description": "Build Conda packages or container images for repeatable delivery."
      },
      {
        "id": "provide-software",
        "label": "Provide software to workers",
        "description": "Make applications, runtimes, and dependencies available to jobs."
      },
      {
        "id": "install-plugins",
        "label": "Install custom plugins",
        "description": "Package or install DCC renderers, extensions, and plugins."
      },
      {
        "id": "configure-workers",
        "label": "Configure workers",
        "description": "Prepare operating systems, software environments, and worker settings."
      },
      {
        "id": "integrate-pipeline",
        "label": "Integrate a studio pipeline",
        "description": "Connect submission, execution, publishing, notifications, and studio services."
      },
      {
        "id": "customize-submission",
        "label": "Customize job submission",
        "description": "Inspect or modify job bundles before they reach Deadline Cloud."
      },
      {
        "id": "troubleshoot-workers",
        "label": "Troubleshoot workers",
        "description": "Create controlled interactive access for diagnosing worker behavior."
      },
      {
        "id": "develop-samples",
        "label": "Develop samples with an agent",
        "description": "Use repository agent skills to create and test consistent samples."
      }
    ],
    "journeys": [
      {
        "id": "new-application",
        "label": "Run a new DCC or application",
        "description": "Choose how to package software, model work, and submit an application job."
      },
      {
        "id": "custom-plugins",
        "label": "Install custom plugins",
        "description": "Choose plugin sync, Conda packaging, or privileged host installation."
      },
      {
        "id": "studio-integration",
        "label": "Integrate studio tools",
        "description": "Connect tools at submission, session, step, task, and event boundaries."
      }
    ]
  },
  "inventory": {
    "roots": [
      {
        "path": "cloudformation/farm_templates",
        "kind": "directory"
      },
      {
        "path": "cloudformation/notification_templates",
        "kind": "directory"
      },
      {
        "path": "terraform/farm_templates",
        "kind": "directory"
      },
      {
        "path": "job_bundles",
        "kind": "directory"
      },
      {
        "path": "job_bundles/custom_submitters",
        "kind": "directory"
      },
      {
        "path": "conda_recipes",
        "kind": "directory"
      },
      {
        "path": "containers",
        "kind": "directory"
      },
      {
        "path": "containers/blender",
        "kind": "directory"
      },
      {
        "path": "queue_environments",
        "kind": "file",
        "pattern": "*.yaml"
      },
      {
        "path": "host_configuration_scripts",
        "kind": "directory"
      },
      {
        "path": "host_configuration_scripts/3dsmax",
        "kind": "directory"
      },
      {
        "path": "host_configuration_scripts/aftereffects",
        "kind": "directory"
      },
      {
        "path": "host_configuration_scripts/cinema4d",
        "kind": "directory"
      },
      {
        "path": "submission_hooks",
        "kind": "directory"
      },
      {
        "path": "utility_scripts",
        "kind": "directory"
      },
      {
        "path": "skills",
        "kind": "directory"
      }
    ],
    "exclusions": [
      {
        "path": "job_bundles/custom_submitters",
        "reason": "Grouping directory; its concrete submitter sample is discovered from the nested root."
      },
      {
        "path": "job_bundles/job_attachments_devguide_output",
        "reason": "Support-only output companion consumed by the job attachments developer-guide sample."
      },
      {
        "path": "conda_recipes/archive_files",
        "reason": "Support-only staging area for vendor archives used while building package recipes."
      },
      {
        "path": "containers/blender",
        "reason": "Grouping directory; its concrete Blender container sample is discovered from the nested root."
      },
      {
        "path": "host_configuration_scripts/3dsmax",
        "reason": "Grouping directory; concrete 3ds Max host configuration samples are cataloged below it."
      },
      {
        "path": "host_configuration_scripts/aftereffects",
        "reason": "Grouping directory; concrete After Effects host configuration samples are cataloged below it."
      },
      {
        "path": "host_configuration_scripts/cinema4d",
        "reason": "Grouping directory; concrete Cinema 4D host configuration samples are cataloged below it."
      }
    ]
  },
  "samples": [
    {
      "path": "cloudformation/farm_templates/cmf_templates",
      "title": "Deploying Deadline Cloud fleet health check",
      "description": "Deploy Lambda and EventBridge resources that continuously monitor and report the health of a customer-managed fleet.",
      "category": "infrastructure",
      "tasks": [
        "manage-fleet",
        "monitor-events"
      ],
      "platforms": [
        "platform-independent"
      ],
      "tags": [
        "cloudformation"
      ],
      "status": "active"
    },
    {
      "path": "cloudformation/farm_templates/cuda_farm",
      "title": "AWS Deadline Cloud farm for running CUDA jobs",
      "description": "This CloudFormation template deploys an AWS Deadline Cloud farm that you can use to run CUDA jobs.",
      "category": "infrastructure",
      "tasks": [
        "deploy-farm",
        "manage-fleet"
      ],
      "platforms": [
        "platform-independent"
      ],
      "tags": [
        "cloudformation",
        "cuda"
      ],
      "status": "active"
    },
    {
      "path": "cloudformation/farm_templates/fleet_standby_scheduling",
      "title": "Scheduled Standby Workers for Deadline Cloud Fleets",
      "description": "This CloudFormation template schedules standby worker count changes on a Deadline Cloud fleet based on a time schedule.",
      "category": "infrastructure",
      "tasks": [
        "deploy-farm",
        "manage-fleet"
      ],
      "platforms": [
        "platform-independent"
      ],
      "tags": [